Title,Company name,Job location,Work experience,Portal link,job listing link,Company's Rating,No. of openings,Applicants,Job_posting_date,Minimum salary,Maximum salary,Average salary,Benefits,Others,Education details,Skills,About company,Job description
BMC Remedy Helix ITSM DeveloperSMEArchitect,Leading Client,Pune,3  8 years,https://www.naukri.com/,https://www.naukri.com/job-listings-bmc-remedy-helix-itsm-developer-sme-architect-transtrack-aeroservices-pvt-ltd-pune-3-to-8-years-200524903413,,94,,2024-05-20,,,,[],"['Role: Technical Architect Industry Type: IT Services & Consulting Department: Engineering - Software & QA Employment Type: Full Time, Permanent Role Category: Software Development']",['Education UG: B.Tech/B.E. in Any Specialization PG: Any Postgraduate'],['Key Skills Skills highlighted with ‘‘ are preferred keyskills SME Solution BMC Helix ITSMBmc RemedyITSMHelixHelix ITSMSolution Design'],About company Transtrack Aeroservices Pvt Ltd Company Info Address: .,"Responsibilities & Tasks SME Solution Architect - Helix Upgrade + Helix Dashboard (2) Responsibilities Minimum years of experience: 6+ years Demonstrated ability: area of expertise BMC Helix ITSM + Helix Dashboard Helix Upgrade & Smart Reporting migration knowledge In-depth knowledge of building interfaces with other tools for all ITSM modules. Analyse the existing solutions and perform the impact assessment. Experience from technical job roles is required, as Solution Architect A Solution-Architect candidate is assessed according to the following tracks: Domain Knowledge (Helix ITSM), Technical Solutioning E2E, Solution Design & Development, development quality, Managing Architecture, stakeholder  management, maintaining performance and quality delivery & teammate 2.  SSI Developer Helix Upgrade + Helix Dashboard (6) Minimum years of experience: 3+ years Demonstrated ability: area of expertise BMC Helix ITSM + Helix Dashboard Helix Upgrade & Smart Reporting migration will be added advantage. Have experience in providing BAU support for complex Helix ITSM application. Analyse the existing solutions and perform the impact assessment. Experience from technical job roles is required, as Solution Architect A Solution-Architect candidate is assessed according to the following tracks: Domain Knowledge (Helix ITSM), Technical Solutioning E2E, Solution Design & Development, development quality, Managing Architecture, stakeholder  Management, maintaining performance and quality delivery & teammate"
Boomi Architect,Ltimindtree,Noida Chennai Bengaluru,12  22 years,https://www.naukri.com/,https://www.naukri.com/job-listings-boomi-architect-ltimindtree-noida-chennai-bengaluru-12-to-22-years-270524006072,3.6,5,46,2024-05-27,Min 15 LPA,Max 50 LPA,Avg. salary - 31.6 LPA,"['Work From Home', 'Health Insurance', 'Cafeteria', 'Soft Skill Training', 'Job Training', 'Team Outings']","['Role: Solution Architect Industry Type: IT Services & Consulting Department: Engineering - Software & QA Employment Type: Full Time, Permanent Role Category: Software Development']",['Education UG: Any Graduate'],['Key Skills Skills highlighted with ‘‘ are preferred keyskills Boomi IntegrationDell Boomi'],"About company LTIMindtree Company Info Address: Technology Center, Gate No. 5, Saki Vihar Road, Po wai , MUMBAI, Maharashtra, India","  Dell Boomi Architect Total IT experience: 12+ years  Dell Boomi experience: 6+ years  Must have very good understanding on Dell Boomi processes and design architecture, various topologies, integrations, iPaaS and EAI concepts  Ensure integration solutions are thoroughly designed and tested for reliability, performance, and security.  Must work with various business stakeholders to understand the requirement and derive the Integration solution. Must involve in architecture discussion with source & target system technical team Ensure the scalabilty of the boomi processes for the enhancements Should have prior experience of handling a Team and managing the complete delivery & communication between different stakeholders including Business, Client SME, Onsite & Offshore team members etc. Very good understanding on different Dell Boomi offerings (elements) including Integration, Master Data Hub, API Management, Flow, Data Catalog & Preparation and EDI/B2B Management  Have done Boomi Environment Setup, Requirement Gathering, Process Design, Error and Exception Handling, Development, Deployment & Hyper care on Dell Boomi  Integration platforms (Cloud & On-Premise)  Should be aware of Boomi Pub/Sub model, Event Based Integrations, Boomi Document Flow, Document Cache, Logging & Monitoring Framework etc.  Must have good understanding of various data formats XML, JSON, CSV, Database and EDI (Good to have) Thorough understanding of REST, SOAP, Web services and API  Communication protocols S/FTP/S, HTTP/S, File I/O, AS2, VAN etc. Have worked on various connectors extensively viz. SAP, SF, WD, SNOW, DB, SuccessFactors and more.  Build Integration technical documentations, high level designs, LLDs Knowledge of coding & scripting in Java, Groovy, JavaScript, etc.  Good at analytics and have a knack of solving complex integration scenarios.  Great interpersonal and communication skills to drive stakeholders' meetings"
BSS Provisioning Architect,Terastar Networks,Bengaluru,10  20 years,https://www.naukri.com/,https://www.naukri.com/job-listings-bss-provisioning-architect-terastar-networks-bengaluru-10-to-20-years-310524009669,,10,74,2024-05-31,,,,[],"['Role: Solution Architect Industry Type: IT Services & Consulting Department: Engineering - Software & QA Employment Type: Full Time, Permanent Role Category: Software Development']",['Education UG: B.Tech/B.E. in Any Specialization PG: Any Postgraduate'],['Key Skills Skills highlighted with ‘‘ are preferred keyskills Solution ArchitectingTelecom BssProvisioning'],"About company Terastar Networks is a product-based software company. We provide software application development services, specifically focusing on OSS and BSS products and solutions in the telecom and network segments. We provide solutions on both public and private cloud platforms.  You can learn more about the company at https://www.terastarnetworks.com/ Should you have any questions or require further clarification regarding the role or the company, please do not hesitate to reach out to us.  Company Info Address: GF-3 , PLOT NO.35, HUDA ENCLAVE Telangana, 500033 , Hyderabad, Telangana, India","Role: BSS Provisioning Architects Experience: 10 - 15 Years Roles and Responsibilities: 1. Review the Business Requirements Specifications/use cases and design end-to-end BSS  Integration Provisioning solutions for projects, integrating multiple systems and ensuring  that designs adhere to agreed design standards and methods 2. Works in close collaboration with the technology teams and vendors to ensure the adoption  of the technology tools and practices 3. Collaborates with architecture, engineering, security, operations and service management  teams to ensure the solutions are stable, performant, and continuously meet business needs  while at the same time ensuring that the NFRs (Non-Functional Requirements) and system  enablers are considered in, captured by, and cascaded to the backlogs 4. Co-ordinate with customer, PMs, infrastructure/operations team, testing teams and  release/change control teams 5. Provide technical leadership on projects, governance and architecture guidance, managing  subject matter experts, business analysts and application designers to ensure the coherency  of end-to-end designs 6. Create and maintain end-to-end architecture artifacts including but not limited to, interface  design document, process design document, sequence diagrams, data flow diagrams and  data models across the BSS ecosystem 7. Create and maintain the solution architecture roadmap across all Epics/User Stories and  produce architecture blueprints for each release iteration, Ensure that compliance to design  is tracked through the project life-cycle through to deployment 8. Manage the solution design throughout the project life-cycle through to deployment,  ensuring that any defects are identified and resolved throughout the process; 9. Lead the Change Management process and ensure that proposed technical changes are  assessed appropriately for the impact and cost to IT systems 10. Supports the implementation teams providing guidance and clarifications on how to  implement the solutions and adopt the best practices. 11. Performs reviews of the deliverables of the development team to assure its quality and  adherence to the best-practices. 12. Identifies potential innovations and adoption of technologies that might be beneficial for the  solution. 13. Works with the relevant stakeholders to articulate and affirm the implications of organisational business strategies on the architecture Skills and Experience: 1. The key purpose of the role is to have a telecom BSS domain expert with experience as an  enterprise / solution architect covering service-oriented architecture, web applications  architecture encompassing several platforms and tools & responsible for the integration  design, applying the patterns and application of the best practices in the implementation of  the Integration solution and its ecosystems. 2. The person should have in-depth knowledge across BSS/OSS systems from lead generation  to order creation, order orchestration, product catalog, inventory management, order  fulfillment, esim management, OTA, activation and billing, mobile number portability, and  also knowledge on network elements like HLR , HSS, UDR , Entitlement Server , SMDB+. 3. The person taking on the role is expected to have an in-depth understanding of all aspects of  integration technology including the service bus, API management, event streaming, etc.  considering all architectural aspects to ensure a fast return of investment and business  continuity 4. The person should have knowledge of System integration lifecycle for a full stack BSS/OSS  implementation and having experience of delivering minimum two BSS transformation  project for Global telecom operators providing GSM/CDMA, 4G/5G, Broadband services 5. The role entails ensuring medium term planning closely aligned with Technical and Business  goals and objectives, driven from a focus on maximising value for both users and customers. 6. The role further entails combining the requirements of both technology, security and  operation teams into the delivery team that will be responsible for the development of the  service order management and provisioning components 7. The person taking on the role is expected to possess a good understanding of the technology  strategy, objectives and the supporting systems and processes / journeys across key  technology areas 8. Good knowledge on REST, JMS, Kafka, other integration technologies 9. Good knowledge on Database technologies lik MySQL, Mongo, Postgress 10. Good knowledge on Cloud native architecture and concepts  Docker, Containerization and  have done cloud native solution deployment 11. Good knowledge on DevOps and CI/CD implementation 12. UML diagrams tools: Micro soft Visio / Plant UML / Camunda 13. Project management tool: - Jira 14. Other Skills: Business analysis, Solution design, Technical writing, Testing, SDLC, STLC, Scrum process, Agile Methodology, TMF eTOM business model, TMF Open API , Micro services , Deployment process."
BSW configuration architect,Advance Career Solutions,Bangalore Rural Chennai Bengaluru,6  11 years,https://www.naukri.com/,https://www.naukri.com/job-listings-bsw-configuration-architect-advance-career-solutions-bangalore-rural-chennai-bengaluru-6-to-11-years-220524011685,,10,19,2024-05-22,,,,[],"['Role: Embedded Systems Engineer Industry Type: IT Services & Consulting Department: Engineering - Software & QA Employment Type: Full Time, Permanent Role Category: Software Development']",['Education UG: Any Graduate'],['Key Skills Skills highlighted with ‘‘ are preferred keyskills AUTOSAR Embedded SoftwarebswBsp'],About company Big4 MNC,"Hello All, We are hiring for our Reputed Big4 MNC client , Job Role-  BSW configuration architect  Experience- 6 to 10 Skill- Autosar, BSW/BSP, Embedded software Location- Bengaluru If anyone interested please share your resume on debasish@acsconsultants.in or 8144609507"
C Architect,Agiliad Technologies,Pune,10  20 years,https://www.naukri.com/,https://www.naukri.com/job-listings-c-architect-agiliad-technologies-pune-10-to-20-years-280524008506,3.9,1,89,2024-05-28,,,,"['Health Insurance', 'Soft Skill Training', 'Work From Home', 'Job Training', 'Cafeteria', 'Team Outings']","['Role: Technical Architect Industry Type: IT Services & Consulting Department: Engineering - Software & QA Employment Type: Full Time, Permanent Role Category: Software Development']",['Education UG: Any Graduate'],['Key Skills Skills highlighted with ‘‘ are preferred keyskills C++ QTDirectXOpenglMedical ImagingVtkCudaDicomOpencvImage ProcessingImagingOpenclComputer Vision'],"About company About Us:  Agiliad is an Engineering and R&D Services company offering a unique combination of domain focus and a deep understanding of diverse products and technologies from embedded systems to cloud platforms. We help customers accelerate their Digital transformation journey through collaborative innovation. With our speed, experience, and execution intensity, we are a strategic partner to the world€™s largest product companies as well as cutting edge startups, delivering impactful outcomes from day one.  Why Agiliad?  Our leadership team of product engineering industry veterans along with our 800+ passionate engineers lend the company an unprecedented ability to deliver and build products of the future and create an impact for our customers and for the communities we operate in. We have built our organization around high-impact teams. Our model not only ensures agility and flexibility for our customers but also ensures constant challenge and development for our engineers. At Agiliad we seek to discover the innovator in all of us and in that process, we aim to provide the opportunities and space necessary for engineers to grow and express themselves. We believe that individual career growth and success can be achieved by creating an environment that reinforces the basic premise of learning by - focusing on fundamentals, spreading knowledge organically, and providing early and diverse exposure. Our work culture provides an excellent environment to - be at the forefront of game changing innovation and grow. Company Info Address: Castlemaine Premises Co-operative Society Ltd, 1st Floor, Unit no. 101 to 102, 42, Sassoon Road, San , PUNE, Maharashtra, India",  Job-Details: Role:   Technical Architect  Experience : 9 - 15 Years Location:  Pune Desired Skills/Competencies: 9 years of experience on C++ development Expert in coding with best practices while developing code in C++ Must have experience in C++ DirectX Good to have experience in DICOM Must have exprience in QT Must have development experience in windows based environment Must have experience on object-oriented analysis and design (OOA and OOD) Must have good knowledge of design patterns Must have good knowledge of software life cycle and architecture Must have good knowledge on data structure and algorithms. Must have excellent analytical and problem-solving skills Must be aware of Agile methodology Good to have experience working on Medical Devices or Health care domain Qualification: B.E/B.Tech  IT/CS/EEE/ECE/Mech/MCA/MCS.BCS/BCA/ME/MTech-CS/IT
C Architect,Persistent,India,12  15 years,https://www.naukri.com/,https://www.naukri.com/job-listings-c-architect-persistent-systems-limited-india-12-to-15-years-141223006703,3.8,1,12,2024-05-29,,,,[],[''],[''],['Key Skills Skills highlighted with ‘‘ are preferred keyskills c++ architectural designinterior designingcproject designprogramautocadworking drawingsjavasystem integrationcomputer sciencesystem architecturebuilding designintegrationconstructiontechnical skillspresentation drawingsprogrammingarchitecturehardware'],,"About Persistent   We are a trusted Digital Engineering and Enterprise Modernization partner, combining deep technical expertise and industry experience to help our clients anticipate what’s next. Our offerings and proven solutions create a unique competitive advantage for our clients by giving them the power to see beyond and rise above. We work with many industry-leading organizations across the world including 14 of the 30 most innovative US companies, 80% of the largest banks in the US and India, and numerous innovators across the healthcare ecosystem.   Our growth trajectory continues, as we reported $765.6M for FY22 revenue (35.2% Y-o-Y). Along with our growth, we’ve onboarded over 4900 new employees in the past year, bringing our total employee count to over 18,500 people located in 19 countries across the globe. Throughout this market leading growth, we’ve maintained strong employee satisfaction - over 94% of our employees approve of the CEO and 89% recommend working at Persistent to a friend.   For more details please login to  www.persistent.com   About The Position   We are looking for a right-brained C++ Architect to perform all the phases of architectural work including planning, designing, and overseeing construction.   You will be involved in new building designs, extensions, alterations, restorations, and conservations from the earliest stages right through to completion. The goal is to match the clients’ needs and to produce sustainable, functional and aesthetically pleasing designs.   Job Location: Pune   What You’ll Do     Carry out, model, and assess complex IT solutions   Design and conduct hardware and software tests   Work closely with network engineers and other IT professionals to choose compatible design solutions   Provide advice to clients on project design, project costs, and expected benefits   Learn clients’ software and hardware needs by interviewing them   Analyze the scope and expected organizational impact of information systems   Develop distributed system architecture and system integration   Prepare a budget for the design and execution of IT solutions   Evaluate existing systems and provide advice on how to meet organizational requirements   Ensure that information systems are secure from threat   Identify and address security threats   Ensure that the technical components of the project are in sync with the business needs of the organization     Expertise you’ll bring     A Bachelor’s degree in computer / software engineering or computer science. However, relevant experience could override this academic qualification   Computer Literacy and Technical Skills   In-depth knowledge of programming languages, including Java and C++   Knowledge of computer networking   Proficiency in applying the knowledge to designing C++ programs and solving problems   Team player — needs to collaborate with other IT professionals and clients to arrive at valid solutions   Excellent communicator — required to communicate complex solutions, in an easy-to-understand manner, to clients and subordinates   Good time management skills — must deliver projects within stipulated time   Organizational skills — ability to plan and organize projects     Benefits     Competitive salary and benefits package   Culture focused on talent development with quarterly promotion cycles and company-sponsored higher education and certifications   Opportunity to work with cutting-edge technologies   Employee engagement initiatives such as project parties, flexible work hours, and Long Service awards   Annual health check-ups    Insurance coverage : group term life , personal accident, and Mediclaim hospitalization for self, spouse, two children, and parents       Our company fosters a values-driven and people centric work environment that enables our employees to:     Accelerate growth, both professionally and personally   Impact the world in powerful, positive ways, using the latest technologies   Enjoy collaborative innovation, with diversity and work-life wellbeing at the core   Unlock global opportunities to work and learn with the industry’s best     Let's unleash your full potential. See Beyond, Rise Above    "
C QT  Architect,Agiliad Technologies,Pune,7  12 years,https://www.naukri.com/,https://www.naukri.com/job-listings-c-qt-architect-agiliad-technologies-private-limited-pune-7-to-12-years-290424903911,3.9,1,67,2024-05-28,,,,"['Health Insurance', 'Soft Skill Training', 'Work From Home', 'Job Training', 'Cafeteria', 'Team Outings']","['Role: Technical Lead Industry Type: IT Services & Consulting Department: Engineering - Software & QA Employment Type: Full Time, Permanent Role Category: Software Development']","['Education UG: BCA in Any Specialization, B.Sc in Any Specialization, B.Tech/B.E. in Any Specialization PG: MCA in Any Specialization, M.Tech in Any Specialization, CS in Any Specialization']",['Key Skills Skills highlighted with ‘‘ are preferred keyskills C++ algorithmsdesign pattermsexperience designdebuggingstldata structuresmultithreadingprogramming'],"About company About Us:  Agiliad is an Engineering and R&D Services company offering a unique combination of domain focus and a deep understanding of diverse products and technologies from embedded systems to cloud platforms. We help customers accelerate their Digital transformation journey through collaborative innovation. With our speed, experience, and execution intensity, we are a strategic partner to the world€™s largest product companies as well as cutting edge startups, delivering impactful outcomes from day one.  Why Agiliad?  Our leadership team of product engineering industry veterans along with our 800+ passionate engineers lend the company an unprecedented ability to deliver and build products of the future and create an impact for our customers and for the communities we operate in. We have built our organization around high-impact teams. Our model not only ensures agility and flexibility for our customers but also ensures constant challenge and development for our engineers. At Agiliad we seek to discover the innovator in all of us and in that process, we aim to provide the opportunities and space necessary for engineers to grow and express themselves. We believe that individual career growth and success can be achieved by creating an environment that reinforces the basic premise of learning by - focusing on fundamentals, spreading knowledge organically, and providing early and diverse exposure. Our work culture provides an excellent environment to - be at the forefront of game changing innovation and grow. Company Info Address: .","Job-Details: Experience : 5+Years Location: Pune Desired Skills/Competencies: Must have experience in C++ Must have good knowledge on Qt Good to have expertise in STL, multi-threading, data structures and algorithms. Extensive hands-on programming experience, design patterms Knowledge of software debugging and profiling tools. Good in communication Qualification: B.E/B.Tech IT/CS/EEE/ECE/Mech/MCA/MCS/BCS/B.Sc-Comp/BCA/ME/MTech-CS/IT"
