Title,Company name,Job location,Work experience,Portal link,job listing link,Company's Rating,No. of openings,Applicants,Job_posting_date,Minimum salary,Maximum salary,Average salary,Benefits,Others,Education details,Skills,About company,Job description
Architect,Mphasis,Chennai,15  17 years,https://www.naukri.com/,https://www.naukri.com/job-listings-architect-mphasis-limited-chennai-15-to-17-years-220524501504,3.5,1,12,2024-05-22,,,,[],"['Role: Solution Architect Industry Type: IT Services & Consulting Department: Engineering - Software & QA Employment Type: Full Time, Permanent Role Category: Software Development']",['Education UG: Any Graduate PG: Any Postgraduate'],['Key Skills Design ArchitectWeb servicesdevopsCloudManager TechnologyInfrastructureDeployment'],"About company Mphasis consistently delivers global Infrastructure Technology Outsourcing, Applications Services Outsourcing and Business Process Outsourcing services through a combination of technology know-how, domain and process expertise. MphasiS brings to their clients a credible and experienced global leadership team driving service delivery through the next generation global delivery model.  Mphasis supports global companies around the world in the improvement of their business processes. We service clients in Financial Services Insurance, Manufacturing, Healthcare, Communications, Media Entertainment, Government, Transportation Logistics, and Consumer Retail industries worldwide.","         Design, architect, and deploy an end-to-end observability framework encompassing logging, metrics, and tracing.              Demonstrate expertise in configuring and integrating various observability tools while fostering a deep understanding of distributed tracing methodologies among feature teams.              Prioritize collaboration by actively guiding feature teams in instrumenting logs and metrics, enabling them to seamlessly adapt and contribute to the observability framework.              Drive best practices for standardization of log formats, tagging, and system-wide correlation ID implementation to ensure holistic observability across complex ecosystems.              Exhibit a strong engineering mindset, bridging the gap between tooling proficiency and practical implementation, enabling a robust and scalable observability infrastructure.                Desired Skills and Experience:            15 Years of experience with following skills              Proven track record of successfully setting up observability frameworks across diverse environments.              Expertise in a range of logging, metrics, and tracing tools, coupled with the ability to orchestrate their integration and configuration seamlessly.              Hands-on experience in driving distributed tracing implementation, fostering collaboration with feature teams, and promoting a culture of observability within the organization.      "
Architect,Patil Infra And Realtors,Khopoli,2  5 years,https://www.naukri.com/,https://www.naukri.com/job-listings-architect-patil-infra-and-realtors-khopoli-2-to-5-years-010624005490,,1,Less than 10,2024-06-01,,,,[],"['Role: Architect Industry Type: Engineering & Construction Department: UX, Design & Architecture Employment Type: Full Time, Permanent Role Category: Architecture & Interior Design']",['Education UG: B.Arch in Any Specialization PG: M.Arch in Any Specialization'],['Key Skills Skills highlighted with ‘‘ are preferred keyskills Sketchup AutoCADREVIT ArchitectureWorking Drawings'],"About company Architecture and construction firm dedicated to delivering innovative and sustainable building solutions. With a commitment to excellence, our team combines creativity and technical expertise to create functional and aesthetically pleasing spaces.","They will have extensive experience in creating detailed technical drawings and plan for construction projects, ensuring accuracy and compliance with industry standards. Proficiency in CAD and understanding of building regulations and processes."
Architect,Primohunt Corporate,Pune,0  8 years,https://www.naukri.com/,https://www.naukri.com/job-listings-architect-primohunt-corporate-pune-0-to-8-years-110722502687,,1,185,2024-05-04,,,,[],"['Role: Architect Industry Type: Recruitment / Staffing Department: UX, Design & Architecture Employment Type: Full Time, Permanent Role Category: Architecture & Interior Design']",['Education UG: B.Arch in Architecture PG: Any Postgraduate'],['Key Skills Marketing HeadArchitectERPConstructionSalesArchitectureValue engineeringMISLegalCRM'],"About company PrimoHunt Corporate Services, an Executive Search & HR Consultancy is a young emerging organization established by HR professional with an aim to provide end to end integrated HR solutions to organizations. We started our operations in 2017 at Pimpri in Pune. We are engage in Recruitment & Recruitment Process Outsourcing (RPO) Service at Senior and Middle Management Levels across various functions in India.","       1.To facilitate synchronized working between various members of project-team and associated external agencies such that Project-activities are completed on time.   2. To ensure requirements of various members of project-team and associated external agencies are served in due time to maintain synchronization and consequently the pace of project-activities based on guidelines received from Design / Construction Head.   3. To offer convenience of single-point- of-contact to various members of project-team and associated external agencies, for purpose of effective and quick communication.       Main Job Responsibilities     Check emails /other communication.    Save selected data on PC. Set priority for issues.   Coordinate with concerned officials for completion of activities and resolve associated issues with help of senior.   Completing Routine-processes as per company’s requirement. E.g Periodic-reports, Dwg-lists, Progress-status etc.   Escalate issues to higher officials, if required.   Data provision to internal departments and external agencies, as required.   Data saving to server, as required.       Managing drawing-record thru drawing-record keeper at site.   Coordination of issues highlighted by sales and Marketing dept.   Coordination with Legal Dept, Qs Dept, Contracts Dept, Planning Dept, Site project Manager and All Respective Consultants.   If necessary do in house working or presentation drawings.   Admin activities-Scan, copy, print, submission of docs within company, courier, lunch arrangement, travel arrangements etc.     Responsibilities Stage Wise   Design Stage   Make sure IFD set is converted in to submission drawings as per local authority rules and regulations.   IFD set is converted in to Sales drawing.   After approval of Design from Construction and Sales - marketing head, drawings and areas are issued to marketing , ERP and sales team.   Make sure that IFD,lisoning, fire and sales drawings are same and there is no discrepancy in drawings as well as in areas.   Make sure that sales docket is as per IFD and Legal drawings.                     "
Architect,Pros Pawns Human Resource Consultants,Gurugram,3  8 years,https://www.naukri.com/,https://www.naukri.com/job-listings-architect-pros-pawns-human-resource-consultants-gurugram-3-to-8-years-150524009766,,1,14,2024-05-28,,,,[],"['Role: Architect Industry Type: Architecture / Interior Design Department: UX, Design & Architecture Employment Type: Full Time, Permanent Role Category: Architecture & Interior Design']","['Education UG: B.Arch in Any Specialization, Diploma in Any Specialization PG: M.Arch in Any Specialization Doctorate: MPHIL in Architecture, Ph.D/Doctorate in Architecture']",['Key Skills AutoCAD 3DAutoCAD 2D'],About company Interior Designing Company,"Knowledge of ACAD , 2D and 3D  Involvement in all stages of project execution including client & site meetings.  Understanding of Building Services & Structural drawings  Coordination with Structure, MEP & HVAC Consultants, Vendors and contractors"
Architect,Qecad,Ahmedabad,0  4 years,https://www.naukri.com/,https://www.naukri.com/job-listings-architect-qecad-ahmedabad-0-to-4-years-260623500606,4.3,1,82,2024-05-04,,,,[],"['Role: Technical Architect Industry Type: Architecture / Interior Design Department: Engineering - Software & QA Employment Type: Full Time, Permanent Role Category: Software Development']",['Education UG: Any Graduate PG: Any Postgraduate'],['Key Skills Architect'],"About company QeCAD is a design &amp;amp;amp;amp;amp;amp;amp; service oriented architectural agency, with an experience of 25 years+ in the international market. A blend of expertise and exposure have helped us evolve into one of the most trusted outsourcing firms. Our in-house technical team, well equipped with top level softwares, has enabled us to cater to various scope &amp;amp;amp;amp;amp;amp;amp; nature of work. We take pride in our recent achievement of serving 300+ clients globally and look forward to efficiently &amp;amp;amp;amp;amp;amp;amp; gradually reach new heights."," Provide assistance in developing construction drawing set which includes, plans, elevations, sections, details.                  Ensures the effective and timely delivery.                  Promote continuous improvement and deliver demonstrable high quality products and services which embrace quality standards          Skills and Proficiencies:     Proficient in AutoCAD, Sketch Up, and related software                  Excellent architectural knowledge, and architectural drafting                  Fair understanding of Structural drawings                  Experience producing construction documents                  Excellent communication, interpersonal, and time-management skill                  Ability to work with minimal supervision                  Expertise in Microsoft Office Suite, Good English Listen, Read and write skills                  Flexible, ambitious and able to work across a range of project types and work stages  "
Architect,Sameer Durve Architects,Mumbai,3  6 years,https://www.naukri.com/,https://www.naukri.com/job-listings-architect-sameer-durve-architects-mumbai-3-to-6-years-041218500058,,1,133,2024-05-04,,,,[],"['Role: Architect Industry Type: Architecture / Interior Design Department: UX, Design & Architecture Employment Type: Full Time, Permanent Role Category: Architecture & Interior Design']",['Education UG: Any Graduate PG: Post Graduation Not Required'],['Key Skills 3DArchitectSoftware designQuality standardsConstructionUsageArchitectureAutoCADProject managementPhotoshop'],"About company Architect, Designer and originator of SDA, Sameer Durve completed Architecture from L.S.Raheja School of Architecture in 2000. A silver medalist in his final year, Sameer Durve has continued to make an impression with his refined ideas and designs.","Control project from start to finish to ensure high quality , innovative and functional design    Take the brief to identify clients needs and put together feasibility reports and design proposals    Develop ideas keeping in mind client s needs , building s usage and environmental impact    Produce detailed blueprints and make any necessary corrections    Compile project specifications    Keep within budgets and timelines    Ensure that all works are carried out to specific standards , building codes , guidelines and regulations    Make on site visits to check on project status and report on project    Cooperate and liaise with construction professionals    Follow architectural trends and advancements    Requirements     Proven working experience as an architect    Strong portfolio to prove artistic skills    Expert knowledge of building products , construction details and relevant rules , regulations and quality standards    Excellent drawing skills and familiarity with design software (Adobe Photoshop , SketchUp , 3d Studio , AutoCad or Ravitt , VIZ or similar)    Strong imagination and the ability to think and create in three dimensions    Visual awareness and an eye for detail    Communication and project management skills.    B.Arch degree from recognized institute    Minimum two years experience."
Architect,Samyak Properties and Infrastructures Pv,New Delhi,1  2 years,https://www.naukri.com/,https://www.naukri.com/job-listings-architect-samyak-properties-and-infrastructure-new-delhi-1-to-2-years-290524007257,,1,Less than 10,2024-05-29,,,,[],"['Role: Architect Industry Type: Real Estate Department: UX, Design & Architecture Employment Type: Full Time, Permanent Role Category: Architecture & Interior Design']",['Education UG: B.Arch in Any Specialization'],['Key Skills Skills highlighted with ‘‘ are preferred keyskills Good Presentation Skills Other Softwares like RevitProficient in using AutoCADUnderstanding of Regulatory and CompliancesDevelop Conceptual Designs'],"About company Samyak Development is a boutique Real Estate Development Company with interest in Haryana and Delhi (Land Pooling and LDRA). The group is professionally managed and has been in the construction business for over four decades. Company Info Address: New Friends Colony, New Delhi - 110025","Architect with good design & presentation skills to collaborate with design & site teams; to develop comprehensive plans for architectural projects, ensure designs meet project requirements; be aware of building regulations & sustainable practices. Required Candidate profile • B.Arch. with 2 yrs experience. • Proficiency in design and presentation softwares. • Develop conceptual designs with the senior team. • Ensure regulatory compliance. • Promote sustainable practices."
Architect,Saurabh Rajput,New Delhi,7  12 years,https://www.naukri.com/,https://www.naukri.com/job-listings-architect-saurabh-rajput-new-delhi-7-to-12-years-200524006527,,5,20,2024-05-20,,,,[],"['Role: Architect Industry Type: Architecture / Interior Design Department: UX, Design & Architecture Employment Type: Full Time, Permanent Role Category: Architecture & Interior Design']",['Education UG: B.Arch in Architecture'],['Key Skills Skills highlighted with ‘‘ are preferred keyskills AutoCADResidentialWorking DrawingsArchitectural DesignInterior Designing SketchupREVIT ArchitectureDetail Drawings'],"About company Saurabh Rajput Architects & Associates"" (SRAA), spearheaded by the distinguished Saurabh Rajput, is more than just an architecture firm. It is a testament to visionary leadership and a commitment to blending innovative design with sustainability. Saurabh, an accomplished architect, urban designer, and environmental specialist, is the driving force behind the firm's exceptional body of work, which transcends the boundaries of traditional architectural practice. Leadership and Vision of Saurabh Rajput Saurabh Rajput's leadership at SRAA is a blend of inspiration, innovation, and insight. His educational background and professional journey reflect a deep commitment to understanding the interplay between built environments and their broader ecological and social contexts. This comprehensive perspective is evident in how SRAA approaches each project, viewing them not just as construction tasks but as opportunities to positively impact communities and environments. SRAA's Design Philosophy The design philosophy at SRAA is grounded in a blend of aesthetic appeal, functionality, and environmental sensitivity. This philosophy reflects Saurabh's belief in the power of architecture to transform spaces and lives while respecting the planet. Every project at SRAA is characterized by a highly detailed design approach. This precision ensures that each aspect of a design is not only aesthetically pleasing but also functional and sustainable. The meticulous attention to detail sets SRAA apart in the architectural landscape, reflecting Saurabh's insistence on excellence. Blend of Traditional and Contemporary SRAA's versatility in architectural styles is remarkable. The firm has demonstrated an exceptional ability to navigate between traditional designs and contemporary architectural approaches. This flexibility allows for the creation of spaces that resonate culturally and historically while embracing modernity and innovation. Expertise in Diverse Projects SRAA's portfolio showcases a profound expertise in a range of project types, particularly in residential and institutional buildings. These projects reflect a deep understanding of diverse architectural needs and challenges, and Saurabh's leadership ensures that each project is approached with a fresh perspective and a commitment to client-specific requirements. Teamwork and Professional Growth at SRAA A key aspect of SRAA's success is its emphasis on teamwork and the professional development of its team members. SRAA fosters a work culture that values collaboration and collective effort. This approach promotes a sense of unity within the team and encourages the exchange of ideas. Such an environment is not only conducive to professional growth but also leads to more comprehensive and innovative design solutions. Nurturing Talent and Career Advancement SRAA is committed to the professional growth of its employees. Saurabh encourages his team to engage in ongoing learning and skill development. By investing in their professional growth, SRAA ensures that its team stays abreast of the latest trends and technologies in architecture, which in turn, contributes to the firm's overall excellence. Sustainability and Environmental Stewardship Under Saurabh's leadership, SRAA has embraced sustainability as a core aspect of its design philosophy. The firm's projects often incorporate green technologies and sustainable materials, aiming to minimize environmental impact. This approach reflects a broader commitment to environmental stewardship and a recognition of the role architects play in shaping sustainable futures. Urban Design SRAA's impact is particularly noticeable in the realm of urban design. Saurabh's experience as an urban designer allows the firm to engage in projects that shape the fabric of urban environments. SRAA's urban projects often reflect a keen understanding of how spaces interact with their social and environmental contexts, a testament to Saurabh's holistic approach to design. Client-Centric Approach SRAA maintains a strong focus on meeting and exceeding client expectations. Each project is approached with a fresh perspective, tailored to the client's unique needs and vision. This client-centric approach has earned SRAA a reputation for delivering projects that are not only aesthetically and functionally superior but also deeply reflective of the clients' values and aspirations. The Future of SRAA Looking forward, SRAA, under Saurabh's leadership, is poised to continue its trajectory of innovative and sustainable design. The firm is increasingly focused on exploring new technologies and methodologies that can further enhance the sustainability and impact of its projects. As the field of architecture evolves, SRAA is keen on integrating advanced technologies such as BIM (Building Information Modeling) and sustainable energy systems into its practice. This technological integration is aimed at enhancing the efficiency and effectiveness of the design and construction processes. Continuing Education and Research Saurabh Rajput's commitment to education and research in architecture remains a cornerstone of SRAA's philosophy. The firm actively engages in research activities and encourages its team to contribute to academic and professional discourse in architecture. This commitment to research and education not only keeps the team at the cutting edge of architectural practice but also contributes to the broader development of the field. Saurabh Rajput Architects & Associates, under the visionary leadership of Saurabh Rajput, stands as a paragon of innovation, sustainability, and excellence in the architectural world. SRAA's commitment to detailed, versatile, and client-centric design, coupled with a focus on teamwork and professional growth, positions the firm at the forefront of shaping sustainable and impactful built environments. As SRAA continues to evolve and expand its horizons, it remains a beacon of inspiration and a testament to the transformative power of architecture. Company Info Address: 849, Madangir, New Delhi, South Delhi, Delhi, 110062, NEW DELHI, Delhi, India","  Planning and designing of residential spaces, landscape and infrastructure (external development), Co-ordinating with structural, MEP and other consultants. Coordination with vendors and selecting the finishing material and giving recommendations. Key skills required : Bachelor in Architecture from a reputed institute. Good Knowledge of Auto-cad, revit (not mandatory) and 3D modelling. Well conversant with building architecture drawings/ Infra "
Architect,Shree Venkatesh Buildcon,Pune Shivaji Nagar ,8  10 years,https://www.naukri.com/,https://www.naukri.com/job-listings-architect-shree-venkatesh-buildcon-pune-8-to-10-years-111223005839,4.8,2,16,2024-05-30,Min 3 LPA,Max 5.1 LPA,Avg. salary - 4.1 LPA,"['Health Insurance', 'Soft Skill Training', 'Job Training', 'Team Outings', 'Gym', 'Transport']","['Role: Architect Industry Type: Real Estate (Co-working) Department: UX, Design & Architecture Employment Type: Full Time, Permanent Role Category: Architecture & Interior Design']",['Education UG: B.Arch in Any Specialization'],['Key Skills Skills highlighted with ‘‘ are preferred keyskills High Rise BuildingArchitectureResidentialAutoCADPresentation Drawings SketchupCoordinationDetailingArchitectural DesignREVITDetail DrawingsReal Estate ConstructionDraftingWorking DrawingsConcept Design'],"About company About Us- Venkatesh Buildcon is a real estate company based in Pune since 2000. Over the past 23 years we have delivered 5500+ homes and built over 50L+ sq.ft. area and are developing around 70L+ sq.ft. area, currently in and around Pune. Vision To enhance the quality of life of our customers by delivering on-time, high quality, value for money housing in India. Mission – To offer affordable luxury homes to all and carving a niche in the realty market. Our Values Legal Compliances Being in the real estate industry, all the legal compliances should be essentially recognized and duly incorporated from time to time. Venkatesh Buildcon ensures that it complies and considers all the current changes that have taken place in the real estate rules, regulations and policies. Timely Delivery As the saying goes ""Time Is Money"", at Venkatesh Buildcon we stand strong by the true value of timely delivery. We ensure that we never skip our deadlines as our professional team makes it a priority to match timelines with complete efficiency. Transparency With us, you will never be left second-guessing; all our services are upfront and transparent. We have enough experience under our belt to offer services that you will remember for a lifetime! Ongoing Projects Venkatesh Erandwane Central Erandwane | 2, 3 & 4 BHK superlative 650 homes Venkatesh Skydale Besides Rajaram Bridge | 2, 3, 4 & 5 BHK luxury 500 homes Venkatesh Viom Kothrud depot | 2 & 3 BHK luxury 80 homes Venkatesh Graffiti Elan & Glover Keshavnagar, Mundhwa | 2 BHK Green 600 Homes Midori Towers Pimple Nilkah | 2, 3 & 4 BHK Duplexes Vertica Balewadi High Street | 12 L sq.f.t commercial spaces Completed Projects Venkatesh Residency Ambegaon Venkatesh Graffiti Keshav Nagar Mundawa Venkatesh Puram Ambegaon Venkatesh Lake Vista Ambegaon Shalini Vishwa Katraj /Ambegaon Venkatesh Joynest Lomi Kalbhor Venkatesh Shrushti Vadgaon Venkatesh Lake Orchid Ambegaon Venatesh Nisarg Vadgaon Venkatesh Navita Ambegaon Venkatesh Serenity Dhayari Venkatesh Lake Life Ambegaon Venkatesh Sharvil Dhayari Venkatesh Graffiti Elite Keshav Nagar Mundhwa Venkatesh Bilwa Dhayarigaon Venkatesh Vrundavan Vadgaon Venkatesh Kshitij Ambegaon Shubham Residency Ambegaon Awards & Achievements Real Estate Icons of Pune (2022) by Times of India Presentation - Shree Venkatesh Buildcon Pvt. Ltd. Real Estate Awards (2022) by Lokmat & News18 – Certificate of Appreciation Presented to our CMD Top Trusted Brand (2021) by Pune Times Mirror to our Company - Shree Venkatesh Buildcon Pvt. Ltd. Promising Real Estate Developer (2021) by Times Of India - Inspiring Men and Women of the Year to our CMD India’s Leading Brand - Rising Star” (2021) by Fortune India Exchange Times Men of the Year 2020 (West India) by Times of India to our CMD Business Leader of the Year (2020) by Pride of Maharashtra SME (MIEDA) to our CMD Achievers of Maharashtra 2020 by Sakal Media Group to our CMD Recruiter Contact Details - 7028157798 / 7028408308 / 9545656677 Company Info Address: 7Th Floor 701 Vikram Monarch Opp Modibaug Model Colony Shivaji Nagar Pune Maharashtra 411016, PUNE, Maharashtra, India","  Architect  Pre-Feasibility- 1. F.S.I. calculation, plot feasibility in terms of basic design, location, zone, etc. Design- 1. Designing the basic sketch of building as per inputs given from directors, internal and external teams Co-ordination (external)- 1. Co-ordination with third party architect and various design consultants in regards with the basic design proposed/ planned as per company inputs Co-ordination (project kick-off) 1. Identification of consultants required for the proposed project as per design given by third party architects and design consultants 2. Communication/ co-ordination with newly on boarded consultant for finalization of working drawings for project estimation 3. Assisting internal teams for launches and other works Co-ordination (execution) 1. Assisting engineering team from execution to delivery of project 2. Assisting internal teams for customer oriented issues"
